{
  "annotator_id": "LT001",
  "annotator_role": "independent RTL reviewer",
  "guideline_version": "1.1",
  "independent_of_tested_model": true,
  "status": "single_annotated",

  "gold_rtl_correct": true,
  "gold_process_correct": false,
  "gold_first_error_stage": "S3",
  "gold_root_error": "S3.4",
  "gold_error_type_l1": "Transition Logic",
  "gold_error_type_l2": "Guard Condition Omission",
  "gold_parent_dependency": [
    {
      "source": "S3.1",
      "target": "S3.4"
    },
    {
      "source": "S3.2",
      "target": "S3.4"
    },
    {
      "source": "S3.3",
      "target": "S3.4"
    }
  ],
  "gold_affected_obligation": [],

  "notes": "S3.4 incorrectly states that ignored inputs leave busy, work_parity, parity, and done unchanged. Ignoring an input means that the input itself does not alter the active frame or published result; it does not freeze all state evolution. In particular, done must clear after its one-cycle pulse even on an idle edge containing an ignored finish or bit, and a start asserted while busy does not block an independently valid frame bit from updating work_parity. The final RTL correctly implements the trusted semantics and passes trusted simulation and bounded formal verification."
}