{
  "annotator_id": "LT001+LT002",
  "annotator_role": "independent RTL reviewers, adjudicated",
  "guideline_version": "1.1",
  "independent_of_tested_model": true,
  "status": "adjudicated",

  "gold_rtl_correct": true,
  "gold_process_correct": true,
  "gold_first_error_stage": null,
  "gold_root_error": null,
  "gold_error_type_l1": null,
  "gold_error_type_l2": null,
  "gold_parent_dependency": [],
  "gold_affected_obligation": [],

  "notes": "LT001 and LT002 independently reviewed the blinded candidate and reached the same conclusion. In the first review, the process correctly modeled synchronous reset, unmasked interrupt capture, lowest-index priority reporting, current-state acknowledgement selection, accumulation of unrelated pending sources, masking of new capture only, and set-dominant simultaneous set/clear behavior. In the second review, the next-state equation was independently checked bit by bit. The acknowledge mask removes only the currently selected lowest pending source, while the OR with irq & ~mask restores an acknowledged source when a simultaneous unmasked interrupt is sampled, exactly implementing set dominance. Changes to mask do not causally clear existing pending state; reset remains a separate higher-priority operation, so the causal wording in S3.4 is not a global state-freeze claim. No substantive process or RTL error was found. Trusted directed simulation and bounded formal verification pass all configured obligations."
}