{
  "annotator_id": "LT001+LT002",
  "annotator_role": "independent RTL reviewers, adjudicated",
  "guideline_version": "1.1",
  "independent_of_tested_model": true,
  "status": "adjudicated",

  "gold_rtl_correct": true,
  "gold_process_correct": false,
  "gold_first_error_stage": "S3",
  "gold_root_error": "S3.3",
  "gold_error_type_l1": "Temporal Semantics",
  "gold_error_type_l2": "Current-vs-Next State Error",
  "gold_parent_dependency": [
    {
      "source": "S2.1",
      "target": "S3.3"
    },
    {
      "source": "S2.2",
      "target": "S3.3"
    }
  ],
  "gold_affected_obligation": [],

  "notes": "Two independent review passes reached the same substantive error conclusion. S1 and S2 correctly establish that active after an edge must equal whether the post-edge count is nonzero. The earliest error is S3.3, which states that any pre-edge cnt>0 produces next_active=1 while decrementing the counter. This is false at the expiration boundary: with cnt==1 and no trigger, next_cnt becomes zero and active must become low immediately after that edge. The error therefore confuses the current nonzero count with the next-state nonzero condition. In the second review, the cnt==1 boundary was independently reconstructed and produced the same contradiction. The final RTL avoids the process error by assigning active from next_cnt!=0 and therefore implements the exact PULSE_CYCLES duration correctly. Trusted directed simulation and bounded formal verification pass all configured obligations."
}
