{
  "annotator_id": "LT001",
  "annotator_role": "independent RTL reviewer",
  "guideline_version": "1.0",
  "independent_of_tested_model": true,
  "status": "single_annotated",

  "gold_rtl_correct": true,
  "gold_process_correct": true,

  "gold_first_error_stage": null,
  "gold_root_error": null,
  "gold_error_type_l1": null,
  "gold_error_type_l2": null,

  "gold_parent_dependency": [],
  "gold_affected_obligation": [],

  "notes": "S1-S5 consistently implement the trusted synchronous FIFO semantics. Read and write acceptance correctly handle full, empty, and partial simultaneous-operation boundaries; occupancy changes by accepted writes minus reads; full and empty reflect current occupancy; accepted reads return the pre-edge oldest unread word; and dout holds when no read is accepted. No substantive process error was identified. Final RTL passes trusted simulation and bounded formal verification."
}