{
  "annotator_id": "LT001",
  "annotator_role": "independent RTL reviewer",
  "guideline_version": "1.1",
  "independent_of_tested_model": true,
  "status": "single_annotated",

  "gold_rtl_correct": true,
  "gold_process_correct": true,
  "gold_first_error_stage": null,
  "gold_root_error": null,
  "gold_error_type_l1": null,
  "gold_error_type_l2": null,
  "gold_parent_dependency": [],
  "gold_affected_obligation": [],

  "notes": "The process correctly captures the current-state token-bucket semantics: automatic saturating replenishment, consumption based only on the pre-edge nonzero count, empty-bucket rejection without replenishment lookahead, middle-occupancy simultaneous replenish and consume, full-bucket consumption, range safety, synchronous reset, and registered grant behavior. The previous req/cnt wording in S4.2 refers to the directly sampled pre-edge values that produce the current registered grant and does not create an invalid cross-reset history dependency. Final RTL passes trusted simulation and bounded formal verification."
}