{
  "annotator_id": "LT001",
  "annotator_role": "independent RTL reviewer",
  "guideline_version": "1.0",
  "independent_of_tested_model": true,
  "status": "single_annotated",
  "gold_rtl_correct": true,
  "gold_process_correct": false,
  "gold_first_error_stage": "S4",
  "gold_root_error": "S4.3",
  "gold_error_type_l1": "Property",
  "gold_error_type_l2": "Incorrect Antecedent",
  "gold_parent_dependency": [
    {
      "source": "S3.2",
      "target": "S4.3"
    },
    {
      "source": "S3.3",
      "target": "S4.3"
    }
  ],
  "gold_affected_obligation": [],
  "notes": "S4.3 states without qualification that only valid write transfers modify the registers and that reads or invalid accesses have no register side effects. As a candidate property this requires a non-reset condition: synchronous reset has highest priority and can change the register state even on an edge that otherwise carries a read or invalid transfer. S1-S3 and the final RTL correctly implement the intended APB behavior, and trusted simulation and bounded formal verification pass all obligations."
}