{
  "annotator_id": "LT001",
  "annotator_role": "independent RTL reviewer",
  "guideline_version": "1.0",
  "independent_of_tested_model": true,
  "status": "single_annotated",

  "gold_rtl_correct": true,
  "gold_process_correct": true,

  "gold_first_error_stage": null,
  "gold_root_error": null,
  "gold_error_type_l1": null,
  "gold_error_type_l2": null,

  "gold_parent_dependency": [],
  "gold_affected_obligation": [],

  "notes": "The S1-S5 process is consistent with the trusted FIFO specification. It correctly defines current-state full/empty flags, legal read and write acceptance including full and empty simultaneous-operation boundaries, circular FIFO ordering, occupancy updates, and registered dout behavior. The full simultaneous read/write case correctly preserves occupancy while returning the pre-edge oldest word and accepting the new write. Final RTL passes trusted simulation and bounded formal verification."
}