{
  "annotator_id": "LT001",
  "annotator_role": "independent RTL reviewer",
  "guideline_version": "1.1",
  "independent_of_tested_model": true,
  "status": "single_annotated",

  "gold_rtl_correct": true,
  "gold_process_correct": true,
  "gold_first_error_stage": null,
  "gold_root_error": null,
  "gold_error_type_l1": null,
  "gold_error_type_l2": null,
  "gold_parent_dependency": [],
  "gold_affected_obligation": [],

  "notes": "The process correctly models synchronous reset, zero-clamped period loading, reset/load/enable/hold priority, enabled countdown, expiry reload from the stored period, disabled hold behavior, and registered tick timing. The prior-edge tick property refers to the immediately preceding transition that produced the registered pulse and does not introduce an invalid cross-reset history dependency. Final RTL passes trusted simulation and bounded formal verification."
}