{
  "annotator_id": "LT001",
  "annotator_role": "independent RTL reviewer",
  "guideline_version": "1.1",
  "independent_of_tested_model": true,
  "status": "single_annotated",

  "gold_rtl_correct": true,
  "gold_process_correct": true,
  "gold_first_error_stage": null,
  "gold_root_error": null,
  "gold_error_type_l1": null,
  "gold_error_type_l2": null,
  "gold_parent_dependency": [],
  "gold_affected_obligation": [],

  "notes": "The process correctly models automatic replenishment, pre-edge current-state consumption acceptance, empty-bucket no-lookahead behavior, simultaneous replenish and consume at middle occupancy, full-bucket consumption, range safety, synchronous reset, and registered grant timing. S4.2 correctly relates the registered grant to the request sampled on the producing edge and the pre-edge token count, without introducing an invalid cross-reset history dependency. No reproducible failure exists within the frozen legal parameter domain, and trusted simulation and bounded formal verification pass all obligations."
}