{
  "annotator_id": "LT001",
  "annotator_role": "independent RTL reviewer",
  "guideline_version": "1.1",
  "independent_of_tested_model": true,
  "status": "single_annotated",

  "gold_rtl_correct": true,
  "gold_process_correct": false,
  "gold_first_error_stage": "S4",
  "gold_root_error": "S4.1",
  "gold_error_type_l1": "Property",
  "gold_error_type_l2": "Incorrect Antecedent",
  "gold_parent_dependency": [
    {
      "source": "S3.1",
      "target": "S4.1"
    },
    {
      "source": "S3.2",
      "target": "S4.1"
    }
  ],
  "gold_affected_obligation": [],

  "notes": "S4.1 states that reg0 or reg1 changes only if the corresponding valid write occurs. The phrase \"changes only if\" is an explicit necessary-condition claim and is therefore interpreted literally under guideline v1.1 rather than being automatically restricted to the reset-disabled runtime domain. A synchronous reset can change a nonzero register to zero without any valid write, providing a legal counterexample. The normal write behavior and final RTL are otherwise correct, and trusted simulation and bounded formal verification pass all obligations."
}