{
  "annotator_id": "LT001",
  "annotator_role": "independent RTL reviewer",
  "guideline_version": "1.0",
  "independent_of_tested_model": true,
  "status": "single_annotated",
  "gold_rtl_correct": true,
  "gold_process_correct": false,
  "gold_first_error_stage": "S4",
  "gold_root_error": "S4.2",
  "gold_error_type_l1": "Property",
  "gold_error_type_l2": "Incorrect Antecedent",
  "gold_parent_dependency": [
    {
    "source": "S3.3",
    "target": "S4.2"
    }
  ],
  "gold_affected_obligation": [],
  "notes": "S4.2 omits the non-reset condition from the rising-edge property. The trusted specification defines O_RISE only for a non-reset sample, while reset has highest priority and forces pulse to 0. Therefore, when rst=1, prev_sample=0, and signal_in=1, S4.2 incorrectly predicts pulse=1. The final RTL itself is correct and passes the trusted simulation and bounded formal checks."
}