{
  "annotator_id": "LT001",
  "annotator_role": "independent RTL reviewer",
  "guideline_version": "1.0",
  "independent_of_tested_model": true,
  "status": "single_annotated",

  "gold_rtl_correct": true,
  "gold_process_correct": false,

  "gold_first_error_stage": "S4",
  "gold_root_error": "S4.1",

  "gold_error_type_l1": "Property",
  "gold_error_type_l2": "Incorrect Consequent",

  "gold_parent_dependency": [
    {
      "source": "S3.1",
      "target": "S4.1"
    }
  ],

  "gold_affected_obligation": [],

  "notes": "S4.1 incorrectly states that after rst is high then low, count and overflow must remain zero at the next edge. The trusted specification defines synchronous reset only for an edge where rst is sampled high. Once rst is low, the next edge may legally load or increment the counter. For example, after reset clears count to zero, a following non-reset edge with en=1 increments count to one, contradicting S4.1. The final RTL itself is correct and passes trusted simulation and bounded formal verification."
}