{
  "annotator_id": "LT001",
  "annotator_role": "independent RTL reviewer",
  "guideline_version": "1.1",
  "independent_of_tested_model": true,
  "status": "single_annotated",

  "gold_rtl_correct": true,
  "gold_process_correct": true,
  "gold_first_error_stage": null,
  "gold_root_error": null,
  "gold_error_type_l1": null,
  "gold_error_type_l2": null,
  "gold_parent_dependency": [],
  "gold_affected_obligation": [],

  "notes": "The process correctly captures request acceptance, ignored acknowledgement on the initial request edge, the exact TIMEOUT_CYCLES service-edge window, acknowledgement priority on the final service edge, ignored requests while busy including the completion edge, and mutually exclusive one-cycle done/timeout pulses. The countdown loaded with TIMEOUT_CYCLES produces timeout exactly after edge N+TIMEOUT_CYCLES with no off-by-one error. The global never-simultaneous pulse property is literally true including reset. Final RTL passes trusted simulation and bounded formal verification."
}