{
  "annotator_id": "LT001+LT002",
  "annotator_role": "independent RTL reviewers, adjudicated",
  "guideline_version": "1.1",
  "independent_of_tested_model": true,
  "status": "adjudicated",

  "gold_rtl_correct": true,
  "gold_process_correct": true,
  "gold_first_error_stage": null,
  "gold_root_error": null,
  "gold_error_type_l1": null,
  "gold_error_type_l2": null,
  "gold_parent_dependency": [],
  "gold_affected_obligation": [],

  "notes": "LT001 and LT002 independently reviewed the blinded candidate and reached the same conclusion. In the first review, the specification understanding, remembered-sample state, registered pulse generation, synchronous reset behavior, held-high suppression, falling-edge suppression, and final RTL were checked sequentially and found consistent with the frozen semantics. In the second review, the reset/history boundary was independently reconstructed. A sampled reset clears prev_q and pulse_q without accepting signal_in, so a high input on the first following non-reset edge is compared against reset history zero and correctly generates a pulse. The combinational reset masking of prev_d and pulse_d still implements synchronous observable reset because the state registers change only on the active clock edge. No stale-history or reset-epoch error was found. Trusted directed simulation and bounded formal verification pass all configured obligations."
}