{
  "annotator_id": "LT001",
  "annotator_role": "independent RTL reviewer",
  "guideline_version": "1.1",
  "independent_of_tested_model": true,
  "status": "single_annotated",

  "gold_rtl_correct": true,
  "gold_process_correct": true,
  "gold_first_error_stage": null,
  "gold_root_error": null,
  "gold_error_type_l1": null,
  "gold_error_type_l2": null,
  "gold_parent_dependency": [],
  "gold_affected_obligation": [],

  "notes": "Under guideline v1.1, S4.4 is an ordinary runtime pointer-update property and does not require an explicit reset qualification. The global one-hot-or-zero invariant is also true during reset. The preceding-edge request property matches the trusted registered-output semantics and does not rely on stale history across reset. Priority encoding, pointer advance after a grant, idle hold, reset behavior, and the liveness boundary are all correctly represented. Final RTL passes trusted simulation and bounded formal verification."
}