{
  "annotator_id": "LT001",
  "annotator_role": "independent RTL reviewer",
  "guideline_version": "1.1",
  "independent_of_tested_model": true,
  "status": "single_annotated",

  "gold_rtl_correct": true,
  "gold_process_correct": true,
  "gold_first_error_stage": null,
  "gold_root_error": null,
  "gold_error_type_l1": null,
  "gold_error_type_l2": null,
  "gold_parent_dependency": [],
  "gold_affected_obligation": [],

  "notes": "Under guideline v1.1, S4.3 is an ordinary runtime rotation/idle property and is interpreted in the reset-disabled operating domain, so omission of an explicit reset guard is not an error. The global one-hot-or-zero property remains literally true during reset. S4.2 is consistent with the trusted registered-grant semantics: a nonzero grant corresponds to the request sampled on the active edge that produced that registered grant, and it does not improperly carry stale request history across a reset epoch. S1-S5 correctly model priority scanning, pointer rotation, idle hold, reset, and registered grant behavior. Trusted simulation and bounded formal verification pass."
}