{
  "annotator_id": "LT001",
  "annotator_role": "independent RTL reviewer",
  "guideline_version": "1.0",
  "independent_of_tested_model": true,
  "status": "single_annotated",

  "gold_rtl_correct": true,
  "gold_process_correct": false,

  "gold_first_error_stage": "S4",
  "gold_root_error": "S4.2",

  "gold_error_type_l1": "Property",
  "gold_error_type_l2": "Incorrect Consequent",

  "gold_parent_dependency": [
    {
      "source": "S2.3",
      "target": "S4.2"
    }
  ],

  "gold_affected_obligation": [],

  "notes": "S4.2 incorrectly states that after rst is sampled high, active and cnt must still be zero at the following edge. Synchronous reset guarantees zero immediately after the edge on which rst is sampled high, but the next edge may legally accept a trigger if rst has been deasserted. In that case active becomes 1 and cnt loads PULSE_CYCLES-1. The final RTL itself correctly implements reset, duration, retrigger, expiry priority, and idle behavior and passes trusted simulation and bounded formal verification."
}